{
  "@context": "https://obligationfirst.org/v1/",
  "@type": "of:Term",
  "@id": "https://everyailaw.com/term/eu-ai-act-recital-135",
  "text": "Deep fakes constitute a particularly serious form of AI-generated or manipulated image, audio or video content with significant potential to deceive natural persons and cause harm to individuals and society. Deployers who use AI systems to generate such content should be required to disclose the artificial nature of such content. Where deep fake content forms part of an evidently artistic, creative, satirical or fictional work, the disclosure obligation should be fulfilled in an appropriate manner that preserves the integrity of the work while ensuring that recipients are not deceived as to the AI-generated or manipulated nature of the content.",
  "section": "Recital (135)",
  "parent_instrument": "https://everyailaw.com/instrument/eu-ai-act",
  "creates": [],
  "notes": "Recital text is approximate; verify against OJ L 2024/1689. Grounds the Article 50(4) deep fake labelling obligation."
}
