{
  "@context": "https://obligationfirst.org/v1/",
  "@type": "of:Term",
  "@id": "https://everyailaw.com/term/eu-ai-act-art-50-2",
  "text": "Providers of AI systems, including general-purpose AI systems, generating synthetic audio, image, video or text content, shall ensure that the outputs of the AI system are marked in a machine-readable format and detectable as artificially generated or manipulated. Providers shall ensure their technical solutions are effective, interoperable, robust and reliable as far as this is technically feasible, taking into account the specificities and limitations of various types of content, the costs of implementation and the generally acknowledged state of the art, as may be reflected in relevant technical standards. This obligation shall not apply to the extent the AI systems perform an assistive function for standard editing or do not substantially alter the input data provided by the deployer or the semantics thereof, or where authorised by law to detect, prevent, investigate or prosecute criminal offences.",
  "section": "Article 50(2)",
  "parent_instrument": "https://everyailaw.com/instrument/eu-ai-act",
  "creates": [
    "https://everyailaw.com/obligation/eu-ai-act-art-50-2-mark-synthetic-content"
  ]
}
